{
  "odp_version": "1.0",
  "query": "standing desk",
  "collection_id": "home-office",
  "include_descendants": true,
  "filters": [
    {
      "id": "material",
      "operator": "in",
      "value": [
        "walnut",
        "oak"
      ]
    },
    {
      "id": "processing_days",
      "operator": "lte",
      "value": 14
    }
  ],
  "sort": "processing-fastest",
  "limit": 50
}
